{
  "format": "agent-company.reference-manifest/v0.1",
  "schema_version": "0.1",
  "supported_layers": [
    "role_kernel",
    "task_pack",
    "current_source_set",
    "job_evidence",
    "evaluation_set"
  ],
  "references": [
    {
      "id": "role-kernel:founder",
      "version": "0.1.0",
      "layer": "role_kernel",
      "owner_role": "founder",
      "ref": "skills/founder-operating-system/references/founder-contract.json",
      "source_url": null,
      "sha256": "667f0afaa2bb53154010e05f5b2ba16ff5d02b0cb16525eae68dcf30f5ad7943",
      "applies_to_tasks": [
        "*"
      ],
      "decision_questions": [
        "Which opportunity deserves the next scarce unit of company attention?"
      ],
      "authority_class": "canonical",
      "allowed_uses": [
        "decision_support",
        "portfolio_recommendation",
        "bounded_handoff"
      ],
      "freshness": {
        "mode": "hash_pinned",
        "reviewed_at": "2026-07-30",
        "expires_at": null,
        "recheck_triggers": [
          "content change",
          "role authority change",
          "quality regression"
        ]
      },
      "loading_cost": "small",
      "dependencies": [],
      "conflicts": [],
      "evaluation_refs": [],
      "status": "active",
      "replaced_by": null
    },
    {
      "id": "task-pack:founder:portfolio-decision",
      "version": "0.1.0",
      "layer": "task_pack",
      "owner_role": "founder",
      "ref": "skills/founder-operating-system/references/task-packs/portfolio-decision.md",
      "source_url": null,
      "sha256": "b29cb019846d3e1a0c19475ab206816682c721f2c7200b12d28e3ff6304f5968",
      "applies_to_tasks": [
        "portfolio-decision"
      ],
      "decision_questions": [
        "What evidence-backed portfolio decision decision should the founder role make, and what evidence would change it?"
      ],
      "authority_class": "operational",
      "allowed_uses": [
        "decision_support",
        "portfolio_recommendation",
        "bounded_handoff"
      ],
      "freshness": {
        "mode": "hash_pinned",
        "reviewed_at": "2026-07-30",
        "expires_at": null,
        "recheck_triggers": [
          "content change",
          "task mapping change",
          "evaluation regression"
        ]
      },
      "loading_cost": "small",
      "dependencies": [
        "role-kernel:founder"
      ],
      "conflicts": [],
      "evaluation_refs": [],
      "status": "active",
      "replaced_by": null
    },
    {
      "id": "task-pack:founder:opportunity-validation",
      "version": "0.1.0",
      "layer": "task_pack",
      "owner_role": "founder",
      "ref": "skills/founder-operating-system/references/task-packs/opportunity-validation.md",
      "source_url": null,
      "sha256": "5c8487f1e3385da6aa46236cab079ca6cfd277e2a11a178b2f00c21aa7a6215e",
      "applies_to_tasks": [
        "opportunity-validation"
      ],
      "decision_questions": [
        "What evidence-backed opportunity validation decision should the founder role make, and what evidence would change it?"
      ],
      "authority_class": "operational",
      "allowed_uses": [
        "decision_support",
        "portfolio_recommendation",
        "bounded_handoff"
      ],
      "freshness": {
        "mode": "hash_pinned",
        "reviewed_at": "2026-07-30",
        "expires_at": null,
        "recheck_triggers": [
          "content change",
          "task mapping change",
          "evaluation regression"
        ]
      },
      "loading_cost": "small",
      "dependencies": [
        "role-kernel:founder"
      ],
      "conflicts": [],
      "evaluation_refs": [],
      "status": "active",
      "replaced_by": null
    },
    {
      "id": "task-pack:founder:continue-change-stop",
      "version": "0.1.0",
      "layer": "task_pack",
      "owner_role": "founder",
      "ref": "skills/founder-operating-system/references/task-packs/continue-change-stop.md",
      "source_url": null,
      "sha256": "b127ed4a77bd8178fc2c8677fc019a11d747cf119861c646067782131155b20e",
      "applies_to_tasks": [
        "continue-change-stop"
      ],
      "decision_questions": [
        "What evidence-backed continue change stop decision should the founder role make, and what evidence would change it?"
      ],
      "authority_class": "operational",
      "allowed_uses": [
        "decision_support",
        "portfolio_recommendation",
        "bounded_handoff"
      ],
      "freshness": {
        "mode": "hash_pinned",
        "reviewed_at": "2026-07-30",
        "expires_at": null,
        "recheck_triggers": [
          "content change",
          "task mapping change",
          "evaluation regression"
        ]
      },
      "loading_cost": "small",
      "dependencies": [
        "role-kernel:founder"
      ],
      "conflicts": [],
      "evaluation_refs": [],
      "status": "active",
      "replaced_by": null
    },
    {
      "id": "role-kernel:planning",
      "version": "0.1.0",
      "layer": "role_kernel",
      "owner_role": "planning",
      "ref": "skills/planning-operating-system/references/planning-contract.json",
      "source_url": null,
      "sha256": "8a76742d7644b13d51ac21e249c9c9017dfb7a54fd38aace9cd59eb021f6d193",
      "applies_to_tasks": [
        "*"
      ],
      "decision_questions": [
        "How should the approved objective become bounded, dependency-safe, verifiable work?"
      ],
      "authority_class": "canonical",
      "allowed_uses": [
        "decision_support",
        "plan_decomposition",
        "bounded_handoff"
      ],
      "freshness": {
        "mode": "hash_pinned",
        "reviewed_at": "2026-07-30",
        "expires_at": null,
        "recheck_triggers": [
          "content change",
          "Uigwe contract change",
          "quality regression"
        ]
      },
      "loading_cost": "small",
      "dependencies": [],
      "conflicts": [],
      "evaluation_refs": [],
      "status": "active",
      "replaced_by": null
    },
    {
      "id": "task-pack:planning:execution-plan",
      "version": "0.1.0",
      "layer": "task_pack",
      "owner_role": "planning",
      "ref": "skills/planning-operating-system/references/task-packs/execution-plan.md",
      "source_url": null,
      "sha256": "db026d2dde678c22be6bd5d8535712d71d679b3111be1549a1611f9cf8cc4847",
      "applies_to_tasks": [
        "execution-planning"
      ],
      "decision_questions": [
        "What evidence-backed execution planning decision should the planning role make, and what evidence would change it?"
      ],
      "authority_class": "operational",
      "allowed_uses": [
        "decision_support",
        "plan_decomposition",
        "bounded_handoff"
      ],
      "freshness": {
        "mode": "hash_pinned",
        "reviewed_at": "2026-07-30",
        "expires_at": null,
        "recheck_triggers": [
          "content change",
          "task mapping change",
          "evaluation regression"
        ]
      },
      "loading_cost": "medium",
      "dependencies": [
        "role-kernel:planning"
      ],
      "conflicts": [],
      "evaluation_refs": [],
      "status": "active",
      "replaced_by": null
    },
    {
      "id": "task-pack:planning:dependency-risk",
      "version": "0.1.0",
      "layer": "task_pack",
      "owner_role": "planning",
      "ref": "skills/planning-operating-system/references/task-packs/dependency-risk.md",
      "source_url": null,
      "sha256": "bbec5e56bcf78e2da5b6db33339c68f400e5356eb96e1c476226a1181255df85",
      "applies_to_tasks": [
        "dependency-risk"
      ],
      "decision_questions": [
        "What evidence-backed dependency risk decision should the planning role make, and what evidence would change it?"
      ],
      "authority_class": "operational",
      "allowed_uses": [
        "decision_support",
        "plan_decomposition",
        "bounded_handoff"
      ],
      "freshness": {
        "mode": "hash_pinned",
        "reviewed_at": "2026-07-30",
        "expires_at": null,
        "recheck_triggers": [
          "content change",
          "task mapping change",
          "evaluation regression"
        ]
      },
      "loading_cost": "medium",
      "dependencies": [
        "role-kernel:planning"
      ],
      "conflicts": [],
      "evaluation_refs": [],
      "status": "active",
      "replaced_by": null
    },
    {
      "id": "task-pack:planning:acceptance-verification",
      "version": "0.1.0",
      "layer": "task_pack",
      "owner_role": "planning",
      "ref": "skills/planning-operating-system/references/task-packs/acceptance-verification.md",
      "source_url": null,
      "sha256": "33eec8107831386563e71b2527f4f10f9c5e64aafc089bdaae0e6fa59ad7d428",
      "applies_to_tasks": [
        "acceptance-verification"
      ],
      "decision_questions": [
        "What evidence-backed acceptance verification decision should the planning role make, and what evidence would change it?"
      ],
      "authority_class": "operational",
      "allowed_uses": [
        "decision_support",
        "plan_decomposition",
        "bounded_handoff"
      ],
      "freshness": {
        "mode": "hash_pinned",
        "reviewed_at": "2026-07-30",
        "expires_at": null,
        "recheck_triggers": [
          "content change",
          "task mapping change",
          "evaluation regression"
        ]
      },
      "loading_cost": "medium",
      "dependencies": [
        "role-kernel:planning"
      ],
      "conflicts": [],
      "evaluation_refs": [],
      "status": "active",
      "replaced_by": null
    },
    {
      "id": "role-kernel:marketing",
      "version": "0.1.0",
      "layer": "role_kernel",
      "owner_role": "marketing",
      "ref": "skills/marketing-operating-system/references/marketing-contract.json",
      "source_url": null,
      "sha256": "dbcb8e073280e1e7ef56995545f820af12e92ecf77d0d53c74796189c4a1c889",
      "applies_to_tasks": [